{
  "$schema": "https://json-schema.org/draft/2020-12/schema",
  "$id": "https://openmw.org/schemas/oblivion-compat-scenario-1.json",
  "title": "OpenMW compatibility scenario",
  "type": "object",
  "required": ["schema_version", "name", "command"],
  "additionalProperties": false,
  "properties": {
    "schema_version": {"const": 1},
    "name": {"type": "string", "minLength": 1},
    "cwd": {"type": "string"},
    "command": {"type": "array", "minItems": 1, "items": {"type": "string"}},
    "environment": {"type": "object", "additionalProperties": {"type": "string"}},
    "directories": {"type": "array", "items": {"type": "string", "minLength": 1}},
    "files": {
      "type": "array",
      "items": {
        "type": "object",
        "required": ["path", "content"],
        "properties": {
          "path": {"type": "string", "minLength": 1},
          "content": {"type": "string"}
        }
      }
    },
    "xvfb": {"type": "boolean"},
    "virtual_gamepad": {"type": "boolean"},
    "width": {"type": "integer", "minimum": 320},
    "height": {"type": "integer", "minimum": 200},
    "timeout_seconds": {"type": "number", "exclusiveMinimum": 0},
    "terminate_after_actions": {"type": "boolean"},
    "expected_exit": {"oneOf": [{"type": "integer"}, {"const": "timeout"}]},
    "expected_log": {"type": "array", "items": {"type": "string"}},
    "forbidden_log": {"type": "array", "items": {"type": "string"}},
    "reviewed_error_log": {"type": "array", "items": {"type": "string", "minLength": 1}},
    "m14": {
      "type": "object",
      "additionalProperties": false,
      "required": ["event_file"],
      "properties": {
        "event_file": {"type": "string", "minLength": 1},
        "fixed_seed": {"type": "integer", "exclusiveMinimum": 0},
        "require_event_file": {"type": "boolean"},
        "minimum_event_count": {"type": "integer", "minimum": 0},
        "maximum_event_count": {"type": "integer", "minimum": 0},
        "required_events": {"type": "array", "items": {"type": "object"}},
        "forbidden_events": {"type": "array", "items": {"type": "object"}},
        "required_event_order": {"type": "array", "items": {"type": "object"}},
        "actor_event_requirements": {"$ref": "#/$defs/actorEventRequirements"},
        "forbidden_event_names": {"type": "array", "items": {"type": "string", "minLength": 1}},
        "forbidden_reason_substrings": {"type": "array", "items": {"type": "string", "minLength": 1}},
        "maximum_repeated_events": {
          "type": "object",
          "additionalProperties": {"type": "integer", "minimum": 1}
        },
        "maximum_route_blocked": {"type": "integer", "minimum": 0},
        "maximum_no_progress_events": {"type": "integer", "minimum": 0},
        "maximum_phase_repeat": {"type": "integer", "minimum": 1}
      }
    },
    "actions": {
      "type": "array",
      "items": {
        "type": "object",
        "required": ["type"],
        "properties": {
          "type": {
            "enum": [
              "sleep",
              "wait_log",
              "gamepad_button",
              "gamepad_axis",
              "screenshot",
              "key",
              "key_down",
              "key_up",
              "key_held",
              "key_hold",
              "type_held",
              "type",
              "mouse_move",
              "mouse_move_absolute",
              "mouse_click",
              "focus_window",
              "command",
              "assert_file",
              "m14_checkpoint",
              "m14_assert_events",
              "m14_observe",
              "m14_actor_distance",
              "m14_advance_clock",
              "m14_console",
              "m14_obstruction",
              "m14_debug_navigation"
            ]
          },
          "seconds": {"type": "number", "minimum": 0},
          "pattern": {"type": "string", "minLength": 1},
          "path": {"type": "string", "minLength": 1},
          "hold_seconds": {"type": "number", "minimum": 0},
          "pause_seconds": {"type": "number", "minimum": 0},
          "name": {"type": "string"},
          "window": {"type": "string"},
          "inspect": {"type": "boolean"},
          "minimum_entropy": {"type": "number", "minimum": 0, "maximum": 1},
          "minimum_mean": {"type": "number", "minimum": 0, "maximum": 1},
          "maximum_mean": {"type": "number", "minimum": 0, "maximum": 1},
          "value": {"type": "string"},
          "x": {"oneOf": [{"type": "integer"}, {"type": "string"}]},
          "y": {"oneOf": [{"type": "integer"}, {"type": "string"}]},
          "button": {"type": "integer", "minimum": 1},
          "delay_ms": {"type": "integer", "minimum": 0},
          "command": {"type": "array", "minItems": 1, "items": {"type": "string"}},
          "commands": {"type": "array", "minItems": 1, "items": {"type": "string", "minLength": 1}},
          "timeout_seconds": {"type": "number", "exclusiveMinimum": 0},
          "expected_exit": {"type": "integer"},
          "path_glob": {"type": "string", "minLength": 1},
          "expected_count": {"type": "integer", "minimum": 0},
          "minimum_size": {"type": "integer", "minimum": 0},
          "contains_ascii": {"type": "array", "items": {"type": "string"}},
          "forbidden_ascii": {"type": "array", "items": {"type": "string"}},
          "checkpoint": {"type": "string", "minLength": 1},
          "observation": {"type": "string", "minLength": 1},
          "actor": {"type": "string", "minLength": 1},
          "label": {"type": "string", "minLength": 1},
          "expected_base": {"type": "string", "minLength": 1},
          "expected_cell": {"type": "string", "minLength": 1},
          "target": {"type": "string", "minLength": 1},
          "minimum_distance": {"type": "number", "minimum": 0},
          "maximum_distance": {"type": "number", "minimum": 0},
          "expected_same_cell": {"type": "boolean"},
          "game_hour": {"type": "number", "minimum": 0, "exclusiveMaximum": 24},
          "hours": {"type": "number", "minimum": 0},
          "year": {"type": "integer", "minimum": 1},
          "month": {"type": "integer", "minimum": 0, "maximum": 11},
          "day": {"type": "integer", "minimum": 0},
          "expected_day": {"type": "integer", "minimum": 1},
          "expected_hour": {"type": "number", "minimum": 0, "exclusiveMaximum": 24},
          "clock_tolerance_hours": {"type": "number", "minimum": 0},
          "settle_seconds": {"type": "number", "minimum": 0},
          "reference": {"type": "string", "minLength": 1},
          "operation": {"enum": ["add", "remove"]},
          "mode": {"enum": ["navmesh"]},
          "minimum_actor_count": {"type": "integer", "minimum": 0},
          "minimum_companion_count": {"type": "integer", "minimum": 0},
          "minimum_mount_count": {"type": "integer", "minimum": 0},
          "minimum_detection_vector_count": {"type": "integer", "minimum": 0},
          "required_mounted_actor": {"type": "string", "minLength": 1},
          "required_mounted_horse": {"type": "string", "minLength": 1},
          "required_dismounted_actor": {"type": "string", "minLength": 1},
          "required_actor_keys": {"type": "array", "items": {"type": "string", "minLength": 1}},
          "actor_state_requirements": {"$ref": "#/$defs/actorStateRequirements"},
          "required_package_types": {"type": "array", "items": {"type": "integer", "minimum": 0, "maximum": 255}},
          "required_phases": {"type": "array", "items": {"type": "integer", "minimum": 0, "maximum": 255}},
          "event_file": {"type": "string", "minLength": 1},
          "minimum_event_count": {"type": "integer", "minimum": 0},
          "maximum_event_count": {"type": "integer", "minimum": 0},
          "required_events": {"type": "array", "items": {"type": "object"}},
          "forbidden_events": {"type": "array", "items": {"type": "object"}},
          "required": {"type": "array", "items": {"type": "object"}},
          "forbidden": {"type": "array", "items": {"type": "object"}},
          "required_event_order": {"type": "array", "items": {"type": "object"}},
          "actor_event_requirements": {"$ref": "#/$defs/actorEventRequirements"},
          "forbidden_event_names": {"type": "array", "items": {"type": "string", "minLength": 1}},
          "forbidden_reason_substrings": {"type": "array", "items": {"type": "string", "minLength": 1}},
          "maximum_repeated_events": {
            "type": "object",
            "additionalProperties": {"type": "integer", "minimum": 1}
          },
          "maximum_route_blocked": {"type": "integer", "minimum": 0},
          "maximum_no_progress_events": {"type": "integer", "minimum": 0},
          "maximum_phase_repeat": {"type": "integer", "minimum": 1}
        }
      }
    }
  },
  "$defs": {
    "actorStateRequirements": {
      "type": "array",
      "items": {
        "type": "object",
        "additionalProperties": false,
        "required": ["actor"],
        "properties": {
          "actor": {"type": "string", "minLength": 1},
          "expected": {"type": "object"},
          "forbidden_values": {
            "type": "object",
            "additionalProperties": {"type": "array"}
          },
          "required_truthy": {
            "type": "array",
            "items": {"type": "string", "minLength": 1}
          },
          "forbidden_interruption_substrings": {
            "type": "array",
            "items": {"type": "string", "minLength": 1}
          }
        }
      }
    },
    "actorEventRequirements": {
      "type": "array",
      "items": {
        "type": "object",
        "additionalProperties": false,
        "required": ["actor"],
        "properties": {
          "actor": {"type": "string", "minLength": 1},
          "minimum_event_count": {"type": "integer", "minimum": 0},
          "maximum_event_count": {"type": "integer", "minimum": 0},
          "required_events": {"type": "array", "items": {"type": "object"}},
          "forbidden_events": {"type": "array", "items": {"type": "object"}},
          "required_event_order": {"type": "array", "items": {"type": "object"}},
          "minimum_event_counts": {
            "type": "object",
            "additionalProperties": {"type": "integer", "minimum": 0}
          },
          "maximum_event_counts": {
            "type": "object",
            "additionalProperties": {"type": "integer", "minimum": 0}
          },
          "allow_bounded_repath": {"type": "boolean"},
          "forbidden_reason_substrings": {
            "type": "array",
            "items": {"type": "string", "minLength": 1}
          }
        }
      }
    }
  }
}
