{
  "schema_version": 1,
  "name": "oblivion-native-load-smoke",
  "cwd": "{source}",
  "files": [
    {
      "path": "config/openmw.cfg",
      "content": "replace=config\nreplace=data\nresources=\"{resources}\"\ndata=\"{resources}/vfs\"\ndata=\"{oblivion_data}\"\nfallback-archive=Oblivion - Meshes.bsa\nfallback-archive=Oblivion - Textures - Compressed.bsa\nfallback-archive=Oblivion - Misc.bsa\nfallback-archive=Oblivion - Sounds.bsa\nfallback-archive=Oblivion - Voices1.bsa\nfallback-archive=Oblivion - Voices2.bsa\ncontent=Oblivion.esm\nno-grab=1\nuser-data=\"{output}/userdata\"\n"
    },
    {
      "path": "config/settings.cfg",
      "content": "[Video]\nresolution x = 1280\nresolution y = 720\nfullscreen = false\nframerate limit = 60\n[Models]\nload unsupported nif files = true\n[General]\nscreenshot format = png\n"
    }
  ],
  "command": [
    "{openmw}",
    "--replace=config",
    "--config",
    "{output}/config",
    "--load-savegame={savegame}",
    "--no-sound=1",
    "--no-grab"
  ],
  "xvfb": true,
  "width": 1280,
  "height": 720,
  "actions": [
    {"type": "sleep", "seconds": 25},
    {"type": "screenshot", "name": "oblivion-after-load.png"}
  ],
  "terminate_after_actions": true,
  "timeout_seconds": 10,
  "expected_exit": 0,
  "expected_log": [
    "Selected game profile: oblivion",
    "Loading saved game 'Quicksave' for character 'Prisoner'",
    "Loading cell ImperialDungeon01"
  ],
  "forbidden_log": [
    "Adding data directory .*vfs-mw",
    "Failed to load saved game",
    "Saved game profile .*cannot be loaded",
    "TES4 runtime state requires missing content",
    "onFrame failed",
    "Can't start .*scripts/omw",
    "Segmentation fault",
    "Assertion.*failed",
    "Aborted"
  ]
}
