{
  "schema_version": 1,
  "name": "oblivion-m7-native-script-reload",
  "cwd": "{source}",
  "files": [
    {
      "path": "config/openmw.cfg",
      "content": "replace=config\nreplace=data\nresources=\"{resources}\"\ndata=\"{oblivion_data}\"\ncontent=Oblivion.esm\ncontent=DLCShiveringIsles.esp\ncontent=DLCBattlehornCastle.esp\ncontent=DLCFrostcrag.esp\ncontent=DLCHorseArmor.esp\ncontent=DLCMehrunesRazor.esp\ncontent=DLCOrrery.esp\ncontent=DLCSpellTomes.esp\ncontent=DLCThievesDen.esp\ncontent=DLCVileLair.esp\ncontent=Knights.esp\nno-grab=1\nuser-data=\"{output}/userdata\"\n"
    },
    {
      "path": "config/settings.cfg",
      "content": "[Video]\nresolution x = 1280\nresolution y = 720\nfullscreen = false\nframerate limit = 60\n[Models]\nload unsupported nif files = true\n"
    }
  ],
  "command": ["{openmw}", "--replace=config", "--config", "{output}/config", "--load-savegame={savegame}", "--no-sound=1", "--no-grab"],
  "xvfb": true,
  "width": 1280,
  "height": 720,
  "actions": [
    {"type": "sleep", "seconds": 80},
    {"type": "focus_window", "name": "OpenMW"},
    {"type": "screenshot", "name": "tutorial-wall-after-reload.png"},
    {"type": "key", "value": "F5"},
    {"type": "sleep", "seconds": 8},
    {"type": "assert_file", "path_glob": "userdata/saves/*/*.omwsave", "expected_count": 1, "minimum_size": 1024, "contains_ascii": ["T4ST", "OMW4STATE"]}
  ],
  "terminate_after_actions": true,
  "timeout_seconds": 150,
  "expected_exit": 0,
  "expected_log": [
    "M7 ObScript runtime: compiled=11051 failed=0",
    "Applied TES4 runtime state:",
    "M7 ObScript: restore sequence=",
    "Writing saved game 'Quicksave'"
  ],
  "forbidden_log": [
    "M7 ObScript diagnostic",
    "M5 interaction: kind=activate result=opened",
    "Failed to load saved game",
    "TES4 runtime state requires missing content",
    "Error in frame",
    "onFrame failed",
    "Segmentation fault",
    "Assertion.*failed",
    "Aborted"
  ]
}
